{
  "schema_version": "1.0",
  "policy_id": "AB09C-recurring-publication",
  "enabled": true,
  "destination_branch": "automation/reports",
  "allowed_files": ["report.json", "review-request.json", "manifest.json"],
  "max_packages_per_run": 10,
  "max_total_bytes": 10485760,
  "max_package_bytes": 2097152,
  "push_mode": "operator-authorized-only",
  "push_enabled": false
}
